url,title,body_text,word_count,sentence_count,flesch_reading_ease,is_thin
https://www.cm-alliance.com/cybersecurity-blog,Cyber Security Blog,"cyber crisis tabletop exercise cyber security awareness training for executives prepare to respond to ransomware attacks learn how to plan, produce & conduct tabletop exercises validate your ransomware readiness is your organisation data-breach ready? one-window view of all security activity assess your cyber incident response & crisis readiness check your cyber health & readiness to respond to cyber-attacks recognise cybersecurity strengths & identify improvements implement and achieve iso 27001 certification secure the weakest link in your cyber security chain full support security as a service cybersecurity advisory services subscription-based, remote cybersecurity service training, plans and templates strengthen your cyber defences with bespoke ir plans created/reviewed custom incident response playbooks respond effectively to cybersecurity incidents with our experts check out our events calendar to know about upcoming events look at past events & see how they helped our clients hear from our clients about the roi achieved through our live events showcase your products/services to an engaged niche audience connect with cybersecurity decision-makers in an intimate setting keynote addresses by our sponsors at wisdom of crowds events digital content assets to elevate your marketing activities visit our blog highly engaged discussions with an experienced ciso our flagship event for live open discussion and collaboration. cma case studies cybersecurity training and consultancy cyber security training feedback a few of our global training & consultancy clients cyber management alliance advisory and management team contact cyber management alliance about us cyber management alliance headquartered in london uk, cyber management alliance ltd. is a world leader in cybersecurity consultancy and training. we have enabled over 750 enterprise clients in 38 countries, including fifa, nhs, capita, bnp paribas and unilever, across all verticals to strengthen their cyber defences.cyber management alliance is also renowned globally as the creator of the uk’s ncsc-certified training courses in incident response. +44 (0) 203 189 1422 info@cm-alliance.com 71-75 shelton street, covent garden, london, wc2h 9jq see below list of our core services & free cybersecurity resources:",348,5,-6.97,True
https://www.varonis.com/blog/cybersecurity-tips,Top 10 Cybersecurity Awareness Tips: How to Stay Safe and Proactive,"top 10 cybersecurity awareness tips: how to stay safe and proactive contents cybersecurity is gaining more importance globally as technology continues to advance. the emphasis on security stems from the need for organizations to be prepared for when, not if, a data breach occurs. unfortunately, human error is often the cause of breaches. understanding how to combat cyberattacks is crucial, as protecting sensitive information is everyone's responsibility in our data-driven world. in honor ofcybersecurity awareness month, we’ve compiled the top security tips you can implement to be more secure. by incorporating these tactics, you decrease the likelihood of your information or actions causing a catastrophic breach. #1 enable multifactor authentication (mfa) multifactor authentication adds an extra layer of security by verifying a user's identity through methods like receiving a verification code or clicking a link when logging in. enabling mfa is crucial because the absence of it increases your vulnerability to risks. “attackers don’t break in; they log in,” said joseph avanzato, a forensics expert at varonis, during a live session onunderstanding a threat actor’s mindset. enable mfa for services that offer it and use an authenticator app if available. report any unusual login attempts immediately. for organizations, it's best to require mfa and restrict the option to disable it. #2 avoid org-wide sharing links. it’s tempting to create a link accessible to anyone, rather than just specific users, in the event that additional stakeholders need access. however, microsoft reports that only 1% of org-wide permissions granted are actually used. a vast amount of business documents contain sensitive information that shouldn't be accessible to everyone in the org, let alone anyone on the internet. removing the ability to create org-wide links can significantly reduce your org’s blast radius. in the average company,157,000 sensitive records are exposed to everyone on the internetthrough saas sharing features, representing $28 million in data-breach risk. rather than opting for an over-permissioned link, users should share files directly with those who need access to do their job and invite others to access on a case-by-case basis. #3 be suspicious of links and unknown contacts. social engineering and phishing tactics are still some of the most effective ways hackers gain access.common signs of phishinginclude a peculiar sender address, a sense of urgency in the request, and prompting users to click a link. phishing simulations are an effective way for organizations to educate teams on the impact of engaging with suspicious communications and encourage users to proactively look for scams. as a consumer or employee, it’s important to vet any unknown senders who contact you via text, email, and more. all it takes is one click to give threat actors keys to the data kingdom. #4 report suspicious activity when it happens. to expand on tip number three, it’s not enough to shrug off a suspicious text message and call it a day. most phishing attempts target more than one user in an organization, so if you receive one, report it to your it department. some companies have plug-ins within their email service or a dedicated inbox to forward suspicious activity to. even a simple response to phishing attempts can backfire, so avoid engaging in any type of conversation. additionally, never share information or make purchases without verifying the contact’s identity. #5 not everyone needs to be an admin. administrative access in cloud platforms like salesforce is powerful. at many organizations, existing admins can grant access to others in these tools without it oversight. this results in too many users having escalated privileges and access to sensitive information. in varonis’dspm snapshot report, we found that 60% of an average company's administrative accounts do not enable mfa, making it easier for attackers to compromise internally exposed data. many orgs are unaware ofthe shared responsibility model, which holds saas providers accountable for securing a platform's infrastructure and providing a highly available solution, while consumers are responsible for protecting and securing their data within. when someone in your organization requests admin access to an application you manage, assess if the request is justified and consider setting an expiration for the permissions to maintain security. coordinate with your it and security teams to ensure all administrators understand the shared responsibility model and adhere to the established permission protocols. #6 assess the access you give third-party apps. imagine signing up for the latest social networking app, and to bypass filling out a lengthy form, you can simply connect it to your gmail account, thus opening up access to your information stored within this app. but while setting this connection up is easy, it’s challenging to understand how the apps are configured and what access they have to information stored in your connected service. there is also the risk that apps contain vulnerabilities that threat actors could exploit. through a single click, access can be granted to these malicious applications. thevaronis threat labs team created an attack scenarioin which we created a realistic-looking app and used a phishing technique to convince a user to install an app and grant full access to their microsoft 365 environment. while our scenario was a simulation, most hackers and ransomware groups wouldn't stop at gaining access and would further exploit the information they find. as the use of third-party apps rises, it’s essential to assess your connected apps and the risks involved with them. we recommend analyzing the permissions for each app and ranking their risk level as low, medium, or high. with varonis, organizations can see how many employees use a third-party app and view their activity levels via automation or manual reporting. to avoid breaches, users who haven’t opened a high-risk app in the last six months should have their permissions revoked. you may want to consider disconnecting the app altogether if it’s not being used. #7 use public wi-fi networks with caution. as technology has evolved, the public expects access to wi-fi nearly everywhere they go, said matt radolec, varonis’ vice president of incident response and cloud operations, inan interview with cnbc. he added that users aren’t reading the terms and conditions or checking urls when connecting to free wi-fi options, increasing their chances of compromise. “it’s almost a game to see how fast you can click ‘accept’ and then ‘sign in’ or ‘connect.’ this is the ploy, especially when visiting a new location; a user might not even know what a legitimate site should look like when presented with a fake site,” matt said. be cautious of free wi-fi networks you connect your device to, and make your computer forget them from your stored networks once you have finished your session. #8 be wary of what you share with gen ai tools. large language models (llms) like chatgpt can use your data to train their systems. if you share sensitive information during a chat, your data might unknowingly appear in another session or, even worse, in a hacker's hands. tools like microsoft 365 copilot are also designed to access everything the user can, which is often far too much.ensure your organization is ready to deploy ai toolssafely before, during, and after rollout. data privacy is a major concern regarding ai. organizations recognize the need to safeguard privacy while maintaining ai functionality, which can be challenging. “we want to leverage llm technology,” varonis security architect brock bauer said during a webinar onllm risks in the cloud. “we want to give the productivity capabilities to our users, but we also need to protect the privacy of the data they're accessing.” when using ai, always keep your sensitive details out of chats. security teams should set up ai policies in their orgs and ensure employees are trained to properly use approved gen ai solutions. #9 perform routine updates when prompted. it can be pesky to see an “automatic restart” window pop up right in the middle of an important task, but the longer you wait to update your computer, the more misconfigurations remain unpatched. patches are solutions to vulnerabilities discovered in different software and cloud platforms. in 2021,our research team identified a bug in salesforce dubbed einstein's wormhole. this bug exposed calendar events that could contain highly sensitive data such as attendee names, emails, meeting urls, passwords, and replies being sent to organizers. before the bug was patched, meeting information with potentially sensitive information was exposed to the entire internet. being proactive with your device and software updates decreases the likelihood of being compromised due to a misconfiguration. #10 use a password manager. password managers let users create complex passwords for all their sign-ins, preventing threat actors from accessing their accounts. whether you use a password manager or not, it is important to create different passwords for different sites, opt for additional security measures like mfa, and set up alerts when logins occur from unknown devices or locations. these small best practices for password generation can be key to preventing data compromise in a breach. don’t wait for a breach to occur. with breaches on the rise, it’s crucial to prioritize cybersecurity. following these preventative cybersecurity tips can help you have stronger security practices at work and at home. for organizations, pairing effective training with top-tier security technology creates an ideal cybersecurity solution. want to learn more? get started witha free data risk assessmentto see if varonis is the right match for you. what should i do now? below are three ways you can continue your journey to reduce data risk at your company: schedule a demo with usto see varonis in action. we'll personalize the session to your org's data security needs and answer any questions. see a sample of our data risk assessmentand learn the risks that could be lingering in your environment.varonis' drais completely free and offers a clear path to automated remediation. follow us onlinkedin,youtube, andx (twitter)for bite-sized insights on all things data security, including dspm, threat detection, ai security, and more.",1896,86,39.79,False
https://www.cisecurity.org/insights/blog/11-cyber-defense-tips-to-stay-secure-at-work-and-home,11 Cyber Defense Tips to Stay Secure at Work and Home,"11 cyber defense tips to stay secure at work and home cybersecurity is inextricably tied to the technology it protects. just as technology continues to grow in variety, quantity, and presence in all of our lives, so too does cybersecurity and our personal responsibility for it. you might be wondering how you can best act on this responsibility. the answer? strengthen your cyber defense at home and at work. provided below are 11 steps that you can use to get started. 1. set cyber defense priorities what are your cyber defense goals? have you identified which devices and data you want to protect? what level of security do they need? by considering these and similar types of questions, you can start to formulate a cybersecurity roadmap that makes sense for you. 2. think before you click hover over a link to reveal the destination url. if it looks different from the hyperlinked text, don’t click on it. it could be an attempt to trick you into visiting a phishing landing page. to protect yourself against phishing attacks, search instead for your intended website or enter the url directly into your browser’s navigation bar. 3. don't get phished speaking of phishing, if you receive a suspicious email at work, don’t open or click on it. instead, follow up with your it and/or security department. how can you tell a suspicious email from a legitimate one? the former will often use a sense of urgency, including a sale, an emergency, or a negative consequence such as an account closure, to motivate you to click on a link or open an email attachment. don't fall for it. if you come across this type of email, just stop, breathe, and forward it to your it and/or your security department. if you receive this type of email on your personal device, delete the email and consider blocking the domain. check out ourshort guide to phishingto learn more. 4. go beyond the password cyber threat actors (ctas) can easily crack passwords like ""password,"" ""admin,"" or ""123456."" the same goes for dictionary-based passwords, or combinations made up of words that you can find in a dictionary. instead of a simple password, try using a passphrase that sometimes substitutes numbers and symbols for letters. this unique approach can help you remember long strings for added security. as an example, consider the weak password “cheese” compared to the complex passphrases “1l0v3(h33s3” (modified from ""ilovecheese"") or “m0r3(h33s3pl3@s3” (modified from ""morecheeseplease""). to properly secure your devices and data, protect your laptop, smartphone, and any other device you use with a secure passphrase such as the examples above. you can also consider using biometric passcodes if your device supports this option, or you can use a pin or matric passcode for authentication. if you end up creating an alphanumeric passphrase with symbols, make sure you use unique combinations for each of your accounts. remember that you can also generate passphrases using a password manager. the benefit there is that you can have the password manager remember each of your passwords so you don't have to. all you need to do is to protect access to your password manager with a strong passphrase and with multi-factor authentication (mfa). check outourpassword policy guideto learn more. 5. if it matters, use mfa to implement multi-factor authentication (mfa), you need to protect your account with authentication mechanisms from at least two of the following categories. use a minimum of two-factor authentication (2fa) on any important accounts or computers where sensitive data is handled. that way, even if a cta gains access to your username and password, they won't be able to access your account without the other factor(s). 6. keep it fresh always install the latest updates for your operating system, browser, and any applications installed on your device. ctas try to use known vulnerabilities to access your devices and/or other devices that are connected to the same network. don’t let yourself (or your organization) become an easy target. 7. reflect, then connect before you connect to an unfamiliar and/or public wi-fi network, think about the risks of doing so. what data might you share over the connection? to minimize the risk of data exposure, use a virtual private network (vpn). a vpn acts as a secure tunnel over the internet by creating an encrypted, private web connection. with a vpn, you can rest assured that your personal or work-related data is secure. 8. shop smart, shop secure shopping online is a modern, everyday convenience. protect sensitive banking data by only shopping on sites you trust. never save your card information where it could be stolen and used later. also, make sure to monitor your payment card records for unfamiliar charges. if you come across anything suspicious, reach out to the payment card issuer to dispute the charge and request a new payment card. 9. avoid configuration confusion configuration sounds like a big responsibility – and it's an important part of your security program. but it really comes down to the settings for a particular program or machine. securely configure your computer, printer, smartphone, and other web-connected devices in your home and your office. 10. don't be the bully when online, remember to be thoughtful and to use polite language. sharing someone’s private personal information online, also known as ""doxxing,"" is never okay and may get you in legal trouble. 11. charge with caution don’t plug your mobile devices into any outlet you find. whether it’s a work or personal device, you could risk becoming the victim of juicejacking, a type of attack where ctas compromise public usb charging stations to infect unsuspecting users with malware or data theft. if you’re worried about running out of battery, bring a back-up power bank or charge your device using your own charging cable and a wall outlet. want even more tips to stay safe at home and at work? as of june 23, 2025, the ms-isac has introduced a fee-based membership. any potential reference to no-cost ms-isac services no longer applies.",1182,61,53.44,False
https://www.cisa.gov/topics/cybersecurity-best-practices,Cybersecurity Best Practices | Cybersecurity and Infrastructure Security Agency CISA,"cybersecurity best practices cybersecurity best practices cyberspace is particularly difficult to secure due to a number of factors: the ability of malicious actors to operate from anywhere in the world, the linkages between cyberspace and physical systems, and the difficulty of reducing vulnerabilities and consequences in complex cyber networks. implementing safe cybersecurity best practices is important for individuals as well as organizations of all sizes. using strong passwords, updating your software, thinking before you click on suspicious links, and turning on multi-factor authentication are the basics of what we call “cyber hygiene” and will drastically improve your online safety. these cybersecurity basics apply to both individuals and organizations. for both government and private entities, developing and implementing tailored cybersecurity plans and processes is key to protecting and maintaining business operations. as information technology becomes increasingly integrated with all aspects of our society, there is increased risk for wide scale or high-consequence events that could cause harm or disrupt services upon which our economy and the daily lives of millions of americans depend. in light of the risk and potential consequences of cyber events, cisa strengthens the security and resilience of cyberspace, an important homeland security mission. cisa offers a range of cybersecurity services and resources focused on operational resilience, cybersecurity practices, organizational management of external dependencies, and other key elements of a robust and resilient cyber framework. cisa helps individuals and organizations communicate current cyber trends and attacks, manage cyber risks, strengthen defenses, and implement preventative measures. every mitigated risk or prevented attack strengthens the cybersecurity of the nation. secure by design it's time to build cybersecurity into the design and manufacture of technology products. featured content cybersecurity best practices services explore the cybersecurity services cisa offers that are available to federal government; state, local, tribal and territorial government; industry; educational institutions; and general public stakeholders. cyber storm: securing cyber space the exercise series brings together the public and private sectors to simulate discovery of and response to a significant cyber incident impacting the nation’s critical infrastructure. cyber range training this course is ideal for those working in cybersecurity roles who are interested in learning technical incident response skills and requires active engagement from all participants. news and alerts discover the latest cisa news on cybersecurity best practices. primary mitigations to reduce cyber threats to operational technology statement on cisa's red team cisa calls for action to close the software understanding gap from awareness to action—cybersecurity for everyone from k through gray helpful resources use cisa's resources to gain important cybersecurity best practices knowledge and skills. if you see something, say something everyone has the power to stop a threat and help secure the nation. read about how, by just reporting suspicious activity or strange behavior, you play an essential role in keeping our communities safe and secure. free cybersecurity services & tools cisa offers a range of cybersecurity assessments that evaluate operational resilience, cybersecurity practices, organizational management of external dependencies, and other key elements of a robust and resilient cyber framework. healthcare and public health cybersecurity together, cisa brings technical expertise as the nation’s cyber defense agency, hhs offers extensive expertise in healthcare and public health, and the hscc cybersecurity working group offers the practical expertise of industry experts. services and training cisa tabletop exercise packages malware analysis state, local, tribal, and territorial stakeholder cybersecurity fundamentals workshops contact us need cisa's help but don't know where to start? organizations can also report anomalous cyber activity and/or cyber incidents 24/7 tocontact@mail.cisa.dhs.govor by calling 1-844-say-cisa (1-844-729-2472)",656,22,3.32,False
https://www.qnbtrust.bank/Resources/Learning-Center/Blog/7-cyber-security-tips,,,0,0,0.0,True
